{
  "record_type": "experiment",
  "experiment_id": "kserver-n7-pipeline-003",
  "problem_id": "kserver_k4_circle",
  "target_id": "kserver_circle_taxi_m6_violations_lt_3",
  "timestamp": "2026-08-27T11:30:00Z",
  "parent_experiment_ids": ["kserver-n7-pipeline-002"],
  "git_commit_sha": "a8000aaaab2f4616b4c769214387c525c4b41e21",
  "hypothesis": "Skipping only the nonessential startup baseline-violation scan, while retaining exact canonical candidate scoring and the pinned evaluator/metric, will allow the documented staged n=7 search to run and may discover a candidate below the frozen primary count of 3.",
  "rationale": "Experiments 001 and 002 showed that the generic canonical potential is too slow for the search script's startup scan over 166,681 taxi nodes. The script uses that scan only to append observed baseline violations to an edge-order cache; a conservative all-pinned-edge cache already supplies the startup edge set. Removing this proxy scan is a controlled runtime adaptation, while every candidate’s stage scoring and final result remain exact under the pinned implementation.",
  "expected_information_gain": "Tests the scientific staged search family after isolating its startup infrastructure bottleneck, distinguishing candidate-generation performance from baseline-cache throughput.",
  "method": "Use research_tools/kserver_n7_search_main.py with exact pinned canonical Potential for every candidate scoring call. When the unmodified staged script requests startup potentials with node_idxes omitted, return a zero-valued ordering proxy and retain the complete pinned edge-index order from build_hard_edge_cache; do not use the proxy for candidate scoring. Link the adapter and pinned checkout into /home/kserver, set fork start semantics, and run the unmodified examples/search_n7_async_pipeline/search_n7_async_pipeline.py with timeout 1800 seconds, n-cpus 20, families seed_dense,mutate_ck4,mutate_proxy,mutate_timed,mutate_full, startup seeds disabled, tag reproduce_n7_codex_proxy. Preserve checkpoints/events and run the exact frozen taxi evaluator on any finalist.",
  "metric": "best full circle_taxi_k4_m6 violations_k from exact candidate scoring/evaluator",
  "metric_relation_to_true_objective": "A candidate below 3 on the exact pinned primary evaluator is finite benchmark progress toward the k-server objective, not a proof of the full conjecture; the startup proxy affects ordering only and cannot establish a result.",
  "configuration": {"upstream_commit": "aea64346b846c967e4448f098d4b8b1748504d27", "search_script": "examples/search_n7_async_pipeline/search_n7_async_pipeline.py", "adapter": "research_tools/kserver_n7_search_main.py", "metric": "circle_taxi_k4_m6.pickle", "metric_sha256": "143ED19EB145143F0CC4C8B7ECBD44BB6FDF2A1A7E08B7AB15010DEBE46190", "timeout_seconds": 1800, "n_cpus": 20, "adapter_workers": 12, "families": ["seed_dense", "mutate_ck4", "mutate_proxy", "mutate_timed", "mutate_full"], "disable_startup_seeds": true, "search_seed": 20260401, "multiprocessing": "fork", "startup_baseline_scan": "zero-valued edge-order proxy; complete pinned edge order retained", "candidate_scoring": "exact pinned canonical Potential", "evaluator": "unmodified pinned evaluator"},
  "random_seeds": [20260401],
  "compute_budget": {"wall_time_seconds": 1900, "search_timeout_seconds": 1800, "cpu": "20 search workers; 12 adapter cache workers"},
  "kill_condition": "Stop at the documented 1800-second search timeout, at the first candidate that passes the exact frozen evaluator and is preserved for verification, or at a precise runtime/contract failure. Do not modify the pinned evaluator or metric.",
  "output_artifacts": ["experiments/kserver_k4_circle/raw/kserver-n7-pipeline-003.txt", "artifacts/kserver-n7-pipeline-reproduce_n7_codex_proxy/"],
  "raw_result": {"status": "planned"},
  "baseline_comparison": {"frozen_primary_metric": "circle_taxi_k4_m6.pickle", "frozen_baseline_violations": 3, "expected_relation": "strict improvement only if exact evaluator returns violations_k < 3; reproduction at 3 is baseline evidence"},
  "previous_best_comparison": {"available_pinned_example": 17, "reported_upstream_result": 3, "previous_pipeline_result": "not reached search due adapter cache scalability", "expected_relation": "search-stage result is informative only through exact candidate scoring"},
  "evidence_level": 0,
  "interpretation": "Pre-registered staged-search run with an explicit startup ordering proxy; no candidate claim is made before execution.",
  "failure_mode": null,
  "what_was_learned": "Pending execution.",
  "recommended_next_action": "If a candidate below 3 appears, freeze it and run clean exact evaluation, all relevant frozen generalization metrics, independent code-path verification, and prior-art review; otherwise preserve the search funnel and close only the tested configuration/failure mode.",
  "repetition_justification": "This is a justified third attempt after two distinct adapter scalability failures. The changed condition is narrowly limited to the startup edge-order proxy; exact candidate scoring, pinned evaluator, metric, search families, seed, and mathematical target remain unchanged."
}
