{
  "record_type": "experiment",
  "experiment_id": "kserver-n7-shared-cache-001",
  "problem_id": "kserver_k4_circle",
  "target_id": "kserver_circle_taxi_m6_violations_lt_3",
  "timestamp": "2026-08-27T02:05:00Z",
  "parent_experiment_ids": ["kserver-n7-pipeline-005"],
  "git_commit_sha": "98da4e92b70cde5b8b01780f5af4835fa4683576",
  "hypothesis": "A single-process search that builds the pinned circle B cache once and evaluates candidates sequentially will remain stable on the current WSL host, identify strong n=7 candidates, and permit at least one exact full circle-taxi evaluation without the cache duplication that broke the prior staged pipeline.",
  "rationale": "The prior three k-server staged configurations all failed during worker initialization. Direct memory inspection found that the n=7 circle cache is approximately 1001 x 279936 int32, about 1.12 GB per process; concurrent fast workers therefore duplicate the dominant allocation. This experiment changes the runtime architecture to one shared cache and sequential candidate evaluation while preserving the pinned matrix, candidate coefficient family, primary metric, and upstream evaluator logic.",
  "expected_information_gain": "Separates a mathematical/search failure from the measured cache-duplication runtime failure. A stable run with completed exact taxi scoring reopens the documented search path; instability or inability to build the one-process cache provides a clean capability boundary.",
  "method": "Load the exact pinned search source at commit aea64346b846c967e4448f098d4b8b1748504d27 and reuse its build_ck4_cache, mutate_vector, evaluate_ck4_cached, Potential, and evaluate_heavy_candidate functions without changing the matrix or scoring logic. Build one complete circle cache in the main process. For at most 600 seconds, generate deduplicated vectors from the pinned seed_dense, seed_sparse, mutate_ck4, mutate_proxy, mutate_timed, and mutate_full families; evaluate every vector exactly on all 6006 circle edges; retain the best circle candidates. Then load the pinned circle-taxi metric and run the unmodified full stage-D candidate evaluator sequentially with one nested potential process on the best two circle candidates or until the 1200-second wall budget expires. Preserve all counts, vectors, timings, errors, and artifact hashes.",
  "metric": "primary: exact circle_taxi_k4_m6 violations_k for each completed full evaluation; capability diagnostics: cache construction, completed circle candidates, best circle violations, and full-evaluator coverage",
  "metric_relation_to_true_objective": "A completed candidate with violations_k < 3 on the pinned circle-taxi metric is finite benchmark progress toward the k-server objective, not a proof of the full conjecture. Circle-only scores and partial runs are runtime/search diagnostics and cannot establish the target.",
  "configuration": {
    "upstream_commit": "aea64346b846c967e4448f098d4b8b1748504d27",
    "search_script": "examples/search_n7_async_pipeline/search_n7_async_pipeline.py",
    "runner": "research_tools/search_kserver_n7_shared.py",
    "adapter": "research_tools/kserver_n7_search_main.py",
    "matrix": [[-1, -1, -1, -1], [1, -2, -3, -4], [1, 2, -5, -6], [1, 3, 5, -7], [1, 4, 6, 7]],
    "circle_metric": "circle_k4_m6.pickle",
    "taxi_metric": "circle_taxi_k4_m6.pickle",
    "taxi_metric_sha256": "143ED19EB145143F0CC4C8B7ECBD44BB6FDF2A1A7E08B7AB15010DEBE46190",
    "search_seconds": 600,
    "wall_time_seconds": 1200,
    "taxi_top": 2,
    "nested_processes": 1,
    "search_seed": 20260827,
    "families": ["seed_dense", "seed_sparse", "mutate_ck4", "mutate_proxy", "mutate_timed", "mutate_full"],
    "candidate_deduplication": true,
    "cache_architecture": "one in-process circle B cache; no fast worker pool",
    "circle_edges": 6006,
    "evaluator": "unmodified pinned evaluator logic"
  },
  "random_seeds": [20260827],
  "compute_budget": {"wall_time_seconds": 1200, "cpu": "one search process plus one nested potential process during sequential taxi evaluation", "memory_intent": "avoid duplicate circle caches"},
  "kill_condition": "Stop at the first completed exact taxi result below 3, at 1200 seconds, or at a precise cache/runtime/contract failure. Do not modify protected evaluator code or infer mathematical infeasibility from a failed capability run.",
  "output_artifacts": ["experiments/kserver_k4_circle/raw/kserver-n7-shared-cache-001.txt", "artifacts/kserver-n7-shared-cache-001.json"],
  "raw_result": {"status": "interrupted_at_wall_budget", "cache_built": true, "cache_shape": [1001, 279936], "cache_bytes": 1120863744, "circle_candidates_completed": 700, "logged_zero_violation_milestones": [400, 500], "taxi_candidates_selected": 2, "taxi_results_completed": 0, "target_reached": false, "termination": "First exact taxi evaluation remained active after the 1200-second wall budget and was interrupted; no taxi violations_k result was produced.", "artifact_sha256": "2546707BEF6AD715BC41EBFD8F3A7BFF0999D47AAD081620C93E0FCAAB0CF889"},
  "baseline_comparison": {"frozen_primary_metric": "circle_taxi_k4_m6.pickle", "frozen_baseline_violations": 3, "expected_relation": "strict improvement only if exact evaluator returns violations_k < 3; reproduction at 3 is baseline evidence"},
  "previous_best_comparison": {"available_pinned_example": 17, "reported_upstream_result": 3, "previous_pipeline_result": "three worker configurations failed before completed scoring", "expected_relation": "shared-cache architecture must first demonstrate completed exact scoring"},
  "evidence_level": 1,
  "interpretation": "The single-process shared-cache architecture successfully built the pinned circle cache and completed 700 exact circle candidates without the worker-initialization failure seen in pipelines 003 through 005. It did not complete even one full circle-taxi evaluation within the 1200-second budget, so it produced no primary-metric result.",
  "failure_mode": "full-pinned-taxi-potential-evaluation-exceeded-1200-second-budget",
  "what_was_learned": "Cache duplication was a real cause of the prior failures, but removing it does not make the full taxi evaluator short enough on this host: one nested batch potential evaluation remained CPU-active beyond the wall budget. Further candidate search using this exact architecture is low-value unless the taxi evaluator is made streaming or a more capable runtime is available.",
  "recommended_next_action": "Close this shared-cache implementation as a capability partial. Only pursue a materially new streaming/full-metric evaluator architecture or a more capable runtime; do not repeat worker-count tuning or claim progress from the zero-violation circle proxy.",
  "repetition_justification": "This is not another worker-count reduction. It removes the fast worker pool entirely, builds the circle cache once, and evaluates the candidate stream sequentially, directly addressing the measured approximately 1.12GB-per-process cache duplication that caused pipeline-003 through pipeline-005 to fail before scoring."
}
