{
  "record_type": "experiment",
  "experiment_id": "dts-neighborhood-cpsat-001",
  "problem_id": "dts_7_5",
  "target_id": "dts_scope_leq_111",
  "timestamp": "2026-08-27T03:05:00Z",
  "parent_experiment_ids": ["dts-neighborhood-exact-001", "dts-cpsat-linux-001"],
  "git_commit_sha": "b2e5499f556a8dd8863fb0857eca1f787745350c",
  "hypothesis": "Candidate-level CP-SAT propagation over the exhaustive radius-3 all-row neighborhood will solve the finite compatibility-cover problem more effectively than the capped Python DFS and may return a validator-accepted scope-111 DTS.",
  "rationale": "The prior all-row enumeration found 48,600 valid row masks and reached depth 5 before a 5,000,000-node DFS cap. Encoding each row mask as a Boolean candidate, requiring exactly one candidate per baseline row, and constraining each difference to appear at most once preserves the finite neighborhood exactly while exposing global propagation to CP-SAT.",
  "expected_information_gain": "Tests whether the coordinated-repair neighborhood contains a target assignment and whether candidate-level exact-cover propagation, rather than integer mark search or naive DFS, can expose it within a bounded Linux run.",
  "method": "Enumerate all 7^5 coordinate perturbations with radius 3 around each published row, retain valid scope<=111 Golomb rows, deduplicate by difference mask, and solve the resulting Boolean exact-cover model under WSL2 Ubuntu 26.04 Python 3.14 with OR-Tools 9.15.6755, eight workers, seed 20260827, and a 120-second timeout. Independently validate any selected seven rows with verify_dts.verify.",
  "metric": "CP-SAT status, candidate-pool cardinality, elapsed time, selected rows, and independent DTS validity",
  "metric_relation_to_true_objective": "A FEASIBLE or OPTIMAL selected cover accepted by the independent integer validator is exactly a true-objective scope<=111 witness; UNKNOWN is solver evidence only and does not imply the finite neighborhood or global problem is infeasible.",
  "configuration": {"scope_limit": 111, "radius_linf": 3, "candidate_generation": "exhaustive 7^5 perturbations per row, mask deduplication", "candidate_count_expected": 48100, "cover_constraints": ["exactly one candidate per row", "at most one selected candidate per difference 1..111"], "solver": "ortools CP-SAT 9.15.6755", "python": "3.14", "runtime": "WSL2 Ubuntu 26.04", "workers": 8, "seconds": 120, "seed": 20260827},
  "random_seeds": [20260827],
  "compute_budget": {"wall_time_seconds": 130, "solver_seconds": 120, "cpu": "8 solver workers"},
  "kill_condition": "Stop after a validator-valid complete assignment or after 120 seconds; preserve UNKNOWN as solver evidence and do not expand the neighborhood during this experiment.",
  "output_artifacts": ["experiments/dts_7_5/raw/dts-neighborhood-cpsat-001.json.txt", "artifacts/dts-neighborhood-cpsat-001.json"],
  "raw_result": {"status": "completed", "target_reached": false, "solver_status": "UNKNOWN", "status_code": 0, "candidate_count": 48100, "pool_sizes": [4783, 7499, 7499, 3206, 9369, 9454, 6290], "elapsed_seconds": 121.65670505700001, "candidate": null, "objective_bound": null, "verification": {"valid": false, "scope": null}, "stdout": "{\"status\": \"UNKNOWN\", \"target_reached\": false, \"elapsed_seconds\": 121.657, \"candidate_count\": 48100, \"output\": \"/mnt/c/Users/Chimdumebi/Desktop/research-charter/artifacts/dts-neighborhood-cpsat-001.json\"}", "artifact_sha256": "38D29245F65FDA736AF1255734B121C395617F20D5A353A5FF55EB9E895D5AC9"},
  "baseline_comparison": {"frozen_scope": 112, "target_scope": 111, "expected_relation": "strict improvement only if selected cover is complete and validator-valid"},
  "previous_best_comparison": {"published_scope": 112, "previous_neighborhood": "48,600 valid masks; Python DFS cap at depth 5", "expected_relation": "new information from exact-cover propagation or a validator-valid witness"},
  "evidence_level": 1,
  "interpretation": "Candidate-level CP-SAT exact-cover propagation over all 48,100 valid radius-3 row masks returned UNKNOWN after 121.657 seconds with no assignment or bound. The finite neighborhood remains unresolved; UNKNOWN is not infeasibility or a DTS result.",
  "failure_mode": "candidate_exact_cover_unknown_within_budget",
  "what_was_learned": "The candidate-level decomposition preserves a substantial finite search space but does not solve it within the tested short budget. Another solver on the same encoding would be low-value unless it provides a materially different proof/propagation capability; the next work should examine structural factorization or a stronger SAT encoding.",
  "recommended_next_action": "If a witness is found, freeze and escalate through independent/adversarial verification; otherwise stop this radius-3 neighborhood family and require a broader structural hypothesis.",
  "repetition_justification": "This changes the search representation from Python DFS over row masks to a Boolean exact-cover CP-SAT model while keeping the same exhaustive radius-3 candidate set and frozen DTS contract. It is not a larger timeout of the prior implementation."
}
