{
  "record_type": "experiment",
  "experiment_id": "dts-wilson-difference-family-001",
  "problem_id": "dts_7_5",
  "target_id": "dts_scope_leq_111",
  "timestamp": "2026-08-27T20:45:00Z",
  "parent_experiment_ids": ["dts-kissat-sequential-001", "dts-ruzsa-split-001"],
  "git_commit_sha": "341d56c0d0f1b882784b9b44a2e66424caeee7aa",
  "hypothesis": "A Wilson finite-field (211,6,1) difference family, with its seven base blocks independently translated and normalized into integer rows, contains a scope-111 (7,5)-DTS.",
  "rationale": "The target needs seven six-mark rows and 105 distinct positive differences. A (211,6,1) difference family has seven six-element blocks whose 210 directed differences cover every nonzero residue exactly once. Independent cyclic translations preserve this modular uniqueness; exhaustively testing all primitive-root construction choices and translations determines whether the family admits seven ordinary rows contained in an interval of length 111.",
  "expected_information_gain": "A dual-verifier-accepted scope-111 witness would be true-objective progress from a finite-field construction. If no witness exists, the exhaustive screen will close this specific Wilson difference-family-to-integer-DTS transfer and report its best exact scope without implying global DTS infeasibility.",
  "method": "Implement the exact Wilson 1972 construction used by Sage's df_q_6_1 for prime field F_211: enumerate primitive roots x, derive r=x^70 and xx=x^5, enumerate all c satisfying the five-coset condition, and form seven blocks {xx^i, xx^i r, xx^i r^2, xx^i c, xx^i c r, xx^i c r^2}. Deduplicate equivalent block families. For every block, enumerate all 211 cyclic translations, normalize each translated set to a sorted row beginning at zero, and exhaustively pack one row per block with disjoint ordinary difference sets. Validate every best and target packing with the repository integer verifier and the independent flat-counter verifier.",
  "metric": "primitive roots, valid Wilson parameters, unique families, translation-normalized row options, exact packings, best verified scope, target witnesses, and dual-verifier validity",
  "metric_relation_to_true_objective": "A complete seven-row assignment accepted by both independent verifiers with scope<=111 is exactly a true-objective witness. A best scope above 111 or a family closure is structural evidence only.",
  "configuration": {"prime": 211, "rows": 7, "marks_per_row": 6, "construction": "Wilson finite-field (q,6,1) difference family", "primitive_root_factors": [2, 3, 5, 7], "translation_set": "all 211 residues per base block", "scope_limit": 111, "verifiers": ["research_tools/verify_dts.py", "research_tools/verify_dts_independent.py"]},
  "random_seeds": [],
  "compute_budget": {"wall_time_seconds": 120, "cpu": "single local Python process", "memory": "available local memory"},
  "kill_condition": "Stop at the first dual-verifier-accepted scope-111 witness or after exhausting all primitive-root/c choices, deduplicated Wilson families, translations, and exact row packings. Do not infer global DTS infeasibility from this finite construction family.",
  "output_artifacts": ["experiments/dts_7_5/raw/dts-wilson-difference-family-001.txt", "artifacts/dts-wilson-difference-family-001.json", "research_tools/search_dts_wilson_difference_family.py"],
  "raw_result": {"status": "completed_exhaustive_family_screen", "target_reached": false, "primitive_roots_checked": 48, "valid_parameter_pairs": 576, "unique_families_checked": 24, "target_count": 0, "best_scope": 153, "best_rows": [[0, 57, 73, 86, 97, 119], [0, 9, 10, 15, 136, 150], [0, 19, 51, 74, 100, 153], [0, 31, 56, 91, 99, 103], [0, 27, 44, 65, 107, 110], [0, 2, 39, 69, 89, 117], [0, 34, 41, 93, 129, 147]], "best_parameters": {"family_index": 2, "generator": 2, "c": 25, "row_translations": [{"block_index": 0, "translation": 72}, {"block_index": 1, "translation": 0}, {"block_index": 2, "translation": 31}, {"block_index": 3, "translation": 0}, {"block_index": 4, "translation": 94}, {"block_index": 5, "translation": 0}, {"block_index": 6, "translation": 74}]}, "candidate": null, "verification": {"primary": {"valid": true, "scope": 153, "unique_difference_count": 105}, "independent": {"valid": true, "scope": 153, "unique_difference_count": 105, "shape_ok": true}}, "elapsed_seconds": 0.22809469999629073, "raw_sha256": "294B185AE154EFF04AA51A4E89711E3FFD11B461CFF6271FEE261209F258B15F", "artifact_sha256": "238E822C4DE7A522EC2BC69C1B9B9968D46E96527A0D5594ACEF9609CB15B5E7", "tool_sha256": "7E1CC2331D46B7D5DB8D17160C55E1139E354238FF194E641AF6E36CA596F9AD"},
  "baseline_comparison": {"frozen_scope": 112, "target_scope": 111, "expected_relation": "strict improvement only if complete and dual-verifier-valid"},
  "previous_best_comparison": {"published_scope": 112, "ruzsa_split_family_best_scope": 195, "expected_relation": "new Wilson finite-field difference-family transfer, not a solver or local-repair repeat"},
  "evidence_level": 1,
  "interpretation": "The exhaustive Wilson finite-field screen found no target witness. Its best complete ordinary DTS has scope 153 and is accepted by both independent verifiers, so this family is structurally valid but far from the frozen scope-111 target.",
  "failure_mode": "wilson-211-difference-family-integer-transfer-best-scope-153",
  "what_was_learned": "All 48 primitive roots and 576 valid Wilson parameters collapsed to 24 block families; all seven blocks in each family had their complete translation-normalized option sets screened by exact disjoint-difference packing. No scope-111 packing exists in the tested family orbit, while the best valid scope is 153. This closes the tested Wilson transfer without implying DTS infeasibility.",
  "recommended_next_action": "Close this Wilson difference-family transfer. Do not spend more compute on its cyclic translations or equivalent primitive-root orbit; resume only with a materially different structural construction or stronger capability.",
  "repetition_justification": "This is a new finite-field difference-family construction and transfer mechanism. It is distinct from the previously tested Ruzsa modular ruler split, polynomial gap families, random catalogues, SAT encodings, and repair searches."
}
