{
  "record_type": "experiment",
  "experiment_id": "dts-separated-catalog-exact-cover-001",
  "problem_id": "dts_7_5",
  "target_id": "dts_scope_leq_111",
  "timestamp": "2026-08-27T06:13:28Z",
  "parent_experiment_ids": ["dts-cpp-exact-cover-001", "dts-global-catalog-001", "dts-difference-allocation-001"],
  "git_commit_sha": "f7e78a34eef8203011225c589b40362ac842c72e",
  "hypothesis": "Separating catalogue construction from exact-cover search and replacing repeated dynamic compatibility-count scans with static rare-difference branching will expose materially more exact-cover search than the prior combined C++ run, while preserving the same exact DTS feasible set.",
  "rationale": "The prior native run reached a one-million-row catalogue but only depth 4 and 16521 search nodes during its combined wall budget. Its dynamic anchor selection rescans large inverted lists for every uncovered difference at every node. A persistent catalogue and static frequency order directly test whether that search-policy overhead, rather than lack of compatible rows, is the dominant barrier.",
  "expected_information_gain": "A substantially deeper finite search without a witness would isolate search-policy cost and quantify the remaining catalogue barrier; a verified scope<=111 assignment would be true-objective progress. A timeout remains finite evidence only.",
  "method": "Compile research_tools/search_dts_cpp_separated_exact_cover.cpp with the pinned WSL2 compiler. Phase A generates up to 1,000,000 deduplicated valid scope<=111 Golomb-ruler masks from seeded uniform sampling and persists a binary catalogue. Phase B reads that exact catalogue, builds the inverted difference index, orders uncovered differences by static catalogue frequency, branches on the first currently uncovered difference with at least one compatible row, allows at most six explicit gaps, and ranks candidates by inverse-frequency rarity. Independently validate any complete seven-row assignment with the repository integer verifier.",
  "metric": "catalogue size, generation attempts, search nodes, maximum depth, gap count, elapsed phase times, returned rows, and independent DTS validity",
  "metric_relation_to_true_objective": "Only a complete seven-row assignment accepted by the independent integer verifier is a scope<=111 true-objective witness; catalogue size, depth, and timeout are finite methodological evidence.",
  "configuration": {"scope_limit": 111, "catalog_size_target": 1000000, "generation_attempt_limit": 10000000, "generation_seconds": 120, "search_seconds": 240, "search_node_limit": 100000000, "seed": 20260828, "mask_representation": "two uint64 bitsets for differences 1..111", "catalog_format": "versioned binary rows with marks and masks", "row_generator": "seeded uniform sorted 5-mark samples with internal Golomb check", "branching": "static rarest currently uncovered difference with six-gap budget", "candidate_order": "inverse-frequency rarity", "compiler": "WSL2 g++"},
  "random_seeds": [20260828],
  "compute_budget": {"wall_time_seconds": 360, "cpu": "single native C++ process per phase", "memory_intent": "persistent compact row catalogue and bounded inverted indexes"},
  "kill_condition": "Stop generation at catalogue target, 10,000,000 attempts, or 120 seconds; stop search at first complete assignment, 240 seconds, 100,000,000 nodes, or precise runtime failure. Independently validate any returned assignment. Do not infer infeasibility from a finite catalogue or timeout.",
  "output_artifacts": ["experiments/dts_7_5/raw/dts-separated-catalog-exact-cover-001-generate.txt", "experiments/dts_7_5/raw/dts-separated-catalog-exact-cover-001-search.txt", "artifacts/dts-separated-catalog-exact-cover-001.json", "research_tools/search_dts_cpp_separated_exact_cover.cpp"],
  "raw_result": {"status": "preregistered"},
  "baseline_comparison": {"frozen_scope": 112, "target_scope": 111, "previous_native_depth": 4, "previous_native_search_nodes": 16521, "expected_relation": "methodological improvement is deeper search; strict objective improvement requires independent validation of scope<=111"},
  "previous_best_comparison": {"uniform_catalog": "250000 rows; 2,000,000 Python DFS nodes; depth 4", "combined_cpp_catalog": "1000000 rows; 16521 nodes; depth 4 within 360 seconds", "expected_relation": "phase separation and static branching should increase search throughput without changing the feasible set"},
  "evidence_level": 0,
  "interpretation": "Pending execution; no result is interpreted before both phases and independent validation.",
  "failure_mode": "pending",
  "what_was_learned": "Pending execution; this experiment discriminates dynamic anchor-count overhead from compatible-row scarcity.",
  "recommended_next_action": "After execution, preserve both phase outputs and independently validate any returned rows; if no witness appears, close this exact-cover implementation unless the measured search depth materially supports a different construction.",
  "repetition_justification": "This is not a repeat of the prior combined C++ run: it persists the catalogue between phases and changes the branch-selection policy from exact dynamic compatibility minimization to a static rare-difference policy, directly testing the diagnosed bottleneck."
}
