{
  "record_type": "experiment",
  "experiment_id": "heilbronn-de-global-001",
  "problem_id": "heilbronn_n12",
  "target_id": "heilbronn_n12_min_area_gt_comellas_yebra",
  "timestamp": "2026-08-27T10:00:00Z",
  "parent_experiment_ids": ["heilbronn-slsqp-001", "heilbronn-baseline-reproduction-001"],
  "git_commit_sha": "909c0d0706b7f06466a67ee66e28e633349bf5c3",
  "hypothesis": "A full-coordinate global differential-evolution search on the absolute minimum-triangle-area objective can escape the locally stable Comellas--Yebra 12-point construction and produce a float64 improvement that merits certified follow-up.",
  "rationale": "The prior source-faithful SLSQP experiment fixed the baseline triangle orientations and returned to the published minimum from every small perturbation. Differential evolution changes both the search family and the orientation treatment, while retaining the source-faithful baseline as an elite seed. The protected transcription is not used.",
  "expected_information_gain": "Separates local stability in one orientation chart from the possibility of a globally distinct 12-point basin, and produces a candidate only if all 220 absolute triangle areas improve together.",
  "method": "Use a NumPy-only differential-evolution population over all 24 point coordinates in [0,1]^24, with one exact source-faithful baseline seed, baseline-perturbed seeds, random seeds, DE/rand/1 mutation with binomial crossover, elite retention, and a bounded Gaussian basin-polish phase. Evaluate the complete 220-triangle absolute-area objective vectorized over each population. Run three fixed seeds and preserve the complete candidate coordinates.",
  "metric": "minimum of all 220 triangle areas in float64, best triangle, and difference from the source-faithful baseline float64 minimum",
  "metric_relation_to_true_objective": "The minimum triangle area is the true objective, but float64 movement is Level 1 only. Any apparent strict improvement requires independent high-precision or certified arithmetic against the exact Comellas--Yebra baseline; failure to improve is not a global negative result.",
  "configuration": {"points": 12, "coordinates": 24, "triangles": 220, "population_size": 96, "generations": 1500, "polish_steps": 7000, "mutation": "DE/rand/1 F=0.8", "crossover_probability": 0.9, "bounds": "[0,1]^24", "baseline_seed": "source-faithful artifacts/baselines/heilbronn_comellas_yebra.json", "protected_transcription_used": false, "implementation": "NumPy only"},
  "random_seeds": [20260828, 20260829, 20260830],
  "compute_budget": {"wall_time_seconds": 240, "cpu": "single native Python process", "generation_evaluations": 4500, "polish_evaluations": 21000},
  "kill_condition": "Stop after the three declared runs or immediately on a candidate whose float64 minimum exceeds the source-faithful baseline by at least 1e-8; do not claim a record before independent certified verification.",
  "output_artifacts": ["experiments/heilbronn_n12/raw/heilbronn-de-global-001.json.txt", "artifacts/heilbronn-de-global-001.json"],
  "raw_result": {"status": "completed", "target_reached": false, "best_minimum_area_float64": 0.03259885869181968, "baseline_minimum_area_float64": 0.03259885869181968, "improvement_over_float_baseline": 0.0, "runs": [{"seed": 20260828, "elapsed_seconds": 16.2268052, "best_minimum_area_float64": 0.03259885869181968, "best_minimum_triangle": [3, 6, 7]}, {"seed": 20260829, "elapsed_seconds": 20.5517445, "best_minimum_area_float64": 0.03259885869181968, "best_minimum_triangle": [3, 6, 7]}, {"seed": 20260830, "elapsed_seconds": 24.724287, "best_minimum_area_float64": 0.03259885869181968, "best_minimum_triangle": [3, 6, 7]}], "candidate": null, "independent_decimal_check": {"valid": true, "triangle_count": 220, "minimum_area": "0.032598858691819690", "minimum_triangles": [[0, 5, 10], [2, 3, 4]], "precision_digits": 100}, "certification_status": "no_strict_improvement; decimal_check_only", "artifact_sha256": "607F9DE37294D99623401329A16DFCFD80B75818735952BD6E9E2781DD41510B", "raw_sha256": "A898B66427962B864BD06EAE56A88ED22BE85CAC6B557BE26FE40592E07C385C"},
  "baseline_comparison": {"frozen_baseline_reference": "comellas_yebra_2002_exact_baseline", "source_faithful_float_baseline": "computed from artifacts/baselines/heilbronn_comellas_yebra.json", "expected_relation": "strict improvement only after certified comparison"},
  "previous_best_comparison": {"heilbronn-slsqp-001": "no float64 improvement from 12 fixed-orientation starts", "expected_relation": "new full-coordinate global search family, not a local SLSQP repeat"},
  "evidence_level": 1,
  "interpretation": "Three full-coordinate differential-evolution runs retained the source-faithful Comellas--Yebra construction as their best state and produced no float64 improvement. An independent 100-digit Decimal recomputation of the retained 17-digit candidate found all 220 triangles valid with minimum area 0.032598858691819690; this is consistent with the exact baseline and is not a strict certified improvement.",
  "failure_mode": "global_differential_evolution_returns_to_source_faithful_baseline",
  "what_was_learned": "The published source-faithful configuration is not escaped by this bounded global DE plus Gaussian polish search under the declared population and generation budget. The result closes this specific global-optimizer family at the tested budget, not the Heilbronn problem or all global optimization methods.",
  "recommended_next_action": "Pause this global DE family and require a genuinely different structured parameterization, a capability change, or resolution of the protected baseline transcription issue before further Heilbronn compute.",
  "repetition_justification": "This is a materially different global optimizer and objective chart from the prior fixed-orientation SLSQP local search; the three seeds are declared for variance assessment rather than parameter tuning."
}
