{
  "record_type": "experiment",
  "experiment_id": "dts-conflict-repair-001",
  "problem_id": "dts_7_5",
  "target_id": "dts_scope_leq_111",
  "timestamp": "2026-08-26T21:24:00Z",
  "parent_experiment_ids": ["dts-local-perturbation-001", "dts-window-exact-001"],
  "git_commit_sha": "f079a7809b49872b4cb58c7fcfefc1692f8e9d9e",
  "hypothesis": "The five conflicts at the clamped scope-111 boundary can be escaped by coordinated two-mark mutations and occasional whole-row replacements across all seven rows, which single-mark local search cannot express.",
  "rationale": "The conflict set links multiple rows and endpoints; allowing temporary internal/global conflicts plus larger reversible moves may cross the local basin separating a valid target from the clamped witness.",
  "expected_information_gain": "Tests whether larger conflict-directed moves increase the exact unique-difference count beyond the stable 100/105 local plateau and identifies whether any gains survive independent validation.",
  "method": "Simulated annealing from the clamped witness. Each move changes two marks in one row or replaces one row randomly; score penalizes internal row collisions and scope overflow, while every best state is independently validated.",
  "metric": "unique positive differences, local row validity, and complete independent DTS validity under scope <=111",
  "metric_relation_to_true_objective": "A validator-accepted 105-unique state is exactly the true target; score gains below 105 are Level 1 exploratory evidence only.",
  "configuration": {"scope_limit": 111, "seeds": [21, 22, 23], "seconds_per_seed": 30, "mark_delta": [-15, 15], "whole_row_replacement_probability": 0.2},
  "random_seeds": [21, 22, 23],
  "compute_budget": {"wall_time_seconds": 100, "per_seed_seconds": 30, "cpu": "single process"},
  "kill_condition": "Stop after three 30-second seeds or immediately on an independently validated scope-111 witness.",
  "output_artifacts": ["experiments/dts_7_5/raw/dts-conflict-repair-001.json.txt"],
  "raw_result": {"status": "completed", "target_reached": false, "best_unique_difference_count": 100, "best_scope": 111, "best_duplicate_set": [13, 36, 53, 100, 111], "runs": [{"seed": 21, "iterations": 98115, "accepted": 34683, "best_score": [100, 100, 0, 0]}, {"seed": 22, "iterations": 90109, "accepted": 31634, "best_score": [100, 100, 0, 0]}, {"seed": 23, "iterations": 96188, "accepted": 33951, "best_score": [100, 100, 0, 0]}]},
  "baseline_comparison": {"frozen_scope": 112, "target_scope": 111, "previous_local_unique_count": 100, "expected_relation": "strict improvement only if valid"},
  "previous_best_comparison": {"published_scope": 112, "expected_relation": "strict improvement only if validator-valid"},
  "evidence_level": 1,
  "interpretation": "No target witness was found. Coordinated two-mark and whole-row mutations remained at the same 100/105 plateau for all seeds, so larger moves under this score did not escape the clamped basin.",
  "failure_mode": "annealing_score_basin_at_clamped_witness",
  "what_was_learned": "The five-conflict clamped state is stable not only to single-mark moves but also to the tested coordinated mutation family; further annealing retuning is unlikely to be informative without a different representation or objective.",
  "recommended_next_action": "Use compatibility-indexed candidate pools/backtracking rather than more annealing variants.",
  "repetition_justification": null
}
